{
  "id": "a1b2c3d4-e5f6-7890-abcd-ef1234567890",
  "user_id": "a1b2c3d4-e5f6-7890-abcd-ef1234567890",
  "account_group_id": "a1b2c3d4-e5f6-7890-abcd-ef1234567890",
  "mandate_id": "a1b2c3d4-e5f6-7890-abcd-ef1234567890",
  "cash_amount": "example-string",
  "currency": "EUR",
  "remittance_information": "example-string",
  "status": "NEW",
  "created_at": "2025-03-15T14:30:00Z"
}